{
  "schemaVersion": "1.0.0",
  "name": "mybun",
  "created": "2020-01-01T00:00:00Z",
  "modified": "2020-01-01T00:00:00Z",
  "credentials": [
    {
      "name": "CLIENT_ID",
      "source": {
        "env": "OAUTH_CLIENT_ID"
      }
    },
    {
      "name": "CLIENT_SECRET",
      "source": {
        "env": "OAUTH_CLIENT_SECRET"
      }
    }
  ]
}